{
  "schema": "bima-policy.v1",
  "policy_id": "dev-infra-repository-audit",
  "revision": "policy-2026-09-12",
  "projects": [
    {
      "project_id": "bima-dev-infra",
      "repository": "Luciansvon/B.I.M.A-DEV-INFRA"
    }
  ],
  "operations": [
    {
      "id": "repository-audit",
      "command_ref": "repository-audit.v1",
      "max_timeout_seconds": 120,
      "output_roots": [
        ".artifacts/policy-gate"
      ],
      "network_destinations": [],
      "credential_names": [],
      "max_attempts": 1
    }
  ],
  "budget": {
    "max_calls": 1,
    "max_runtime_seconds": 120
  }
}
